{
  "message_id": "a1b2c3d4e5f6789012345678abcdef0123456789",
  "system_version": "v1.2",
  "anchor_date": "2026-08-10",
  "scan_id": "20260810-025",
  "scan_sequence": 25,
  "scan_timestamp_utc": "2026-08-10T06:15:00Z",
  "generated_at_utc": "2026-08-10T06:16:52Z",
  "expires_at_utc": "2026-08-10T06:30:00Z",
  "symbol": "XXXUSDT",
  "underlying_asset": "XXX",
  "canonical_asset_id": "xxx-token",
  "contract_multiplier": 1,
  "direction": "LONG",
  "state": "CONFIRMED",
  "state_duration_minutes": 210,
  "direction_confidence": 1.0,
  "total_score": 84.2,
  "liquidity_score": 88,
  "momentum_score": 81,
  "market_cap_momentum_score": 72,
  "staircase_score": 78,
  "trend_consistency_score": 85,
  "rank_velocity_score": 74,
  "risk_score": 100,
  "data_confidence": 96,
  "market_rank": 1,
  "tier_rank": 1,
  "market_cap_tier": "T3",
  "coingecko_coin_id": "xxx-token",
  "circulating_supply": 4200000000,
  "market_cap_calculated": 331000000,
  "market_cap_coingecko": 329000000,
  "risk_flags": [],
  "data_mode": "LIVE",
  "reason_codes": [
    "G1A",
    "G2OK",
    "G3OK",
    "SS3",
    "OI_UP",
    "RANK_IMPROVING",
    "PATH_S"
  ],
  "indicator_version": "g1g2g3g4-sm-dual-path",
  "parameter_version": "param-v1.3.0-dual-path-sticky",
  "mapping_version": "map-20260810",
  "data_version": "data-20260810-025",
  "attribution": "Powered by CoinGecko",
  "confirm_path": "S"
}
